texte,label 
"ArcelorMittal met en pause ses projets de décarbonation à Dunkerque, le secteur durcit son bras de fer avec l’UE Face à la surproduction d’acier en Chine et la dégringolade des cours, le 
leader mondial comme le reste du secteur exigent de Bruxelles des garanties 
avant de se décarboner. Or cette électrification est indispensable à 
l’industrie lourde si elle veut survivre sur le continent.",0
"« Faut qu’on parle » : à la Maison de la conversation, des rencontres pour « sortir de sa bulle » 

« Faut qu’on parle », une opération lancée par La Croix et le média Brut 
permet à des personnes qui ont des opinions diverses d’échanger ce samedi 
23 novembre. Plusieurs binômes ont décidé de se rencontrer à la Maison de 
la conversation, dans le 18e arrondissement de Paris.
",0
"En Namibie, un scrutin décisif pour le parti au pouvoir depuis trente-quatre ans Après avoir régné en maître sur le paysage politique pendant plus de trente 
ans, le parti au pouvoir en Namibie, la Swapo, est menacé par l’arrivée 
d’une nouvelle génération d’électeurs plus sensibles aux problèmes 
économiques qu’à l’héritage de la lutte de libération du pays.",0
"Préservatifs, en mettre ou pas ? Le port de la capote s’érode chez les jeunes Les moins de 30 ans représentent l’une des populations les plus à risque de 
transmission des infections sexuellement transmissibles. Pourtant, selon la 
dernière enquête de l’Inserm et de l’ANRS, l’usage du préservatif lors du 
premier rapport sexuel a diminué entre 2019 et 2023.",0
"Non, le mandat d’arrêt de la CPI contre Benyamin Nétanyahou n’est pas un acte antisémite Discuter du bien-fondé de l’arrêt de Cour pénale internationale est tout à 
fait compréhensible mais le qualifier comme tel est un argument qui 
n’aidera pas ceux qui, dans nos pays où l’on déplore une augmentation 
dramatique de l’antisémitisme, luttent contre la haine des juifs.",0
"Agriculteurs en colère : dans les Pyrénées-Orientales, «on est tous prêts à continuer» A la frontière espagnole, la Coordination rurale a bloqué le péage du 
Boulou pendant vingt-quatre heures pour dénoncer la concurrence déloyale 
des marchandises étrangères. Forcés de lever le camp ce mercredi 
20 novembre, les agriculteurs assurent vouloir poursuivre les actions.",0
"Budget 2025 : le Sénat repousse une hausse sur l’électricité mais vote pour augmenter le gaz Les sénateurs, de droite comme de gauche, se sont prononcés mardi 
26 novembre au soir contre une disposition du gouvernement visant à 
augmenter la TICFE sur l’électricité dans le projet de loi de finances pour 
l’an prochain. A la place, ils préfèrent relever la taxe sur le gaz.",0
"Une version inédite du « Napoléon » d’Abel Gance 

Chef-d’œuvre du cinéma muet, Napoléon vu par Abel Gance va être diffusé 
pour la première fois dans sa version originale et en deux parties, le 
22 novembre sur France 5. Il aura fallu seize ans à son restaurateur 
Georges Mourier pour restituer le film dans sa version de 1927.
",0
"Dans l’affaire des câbles sous-marins endommagés en mer Baltique, l’étau se resserre autour du bateau chinois « Yi-Peng 3 » « Le Monde » a pu reconstituer l’itinéraire du « Yi-Peng 3 ». Ces données 
permettent de comprendre pourquoi ce navire marchand, actuellement 
immobilisé entre la Suède et le Danemark, est le suspect numéro un 
concernant les dégâts causés à deux câbles sous-marins en mer Baltique.",0
"VIH: le traitement préventif doit être proposé plus largement, selon les autorités sanitaires Il y a encore trop de diagnostics tardifs d’infections au VIH en France, 
alerte la Haute autorité de santé. Le traitement doit donc être étendu à 
toutes les situations estimées «à risque d’exposition» au virus, «quels que 
soient le genre et l’orientation sexuelle des personnes».",0
"Réseaux sociaux : « Je ne vois plus trop l’intérêt d’exposer sa vie sur Facebook » 

Par lassitude ou par conscience de protection des données numériques, de 
plus en plus d’internautes hésitent à publier des contenus très personnels 
sur les réseaux, bien que le phénomène ne soit pas encore quantifié. Ils 
privilégient des groupes de discussion plus restreints.
",0
"Les glaciers alpins fondent et donnent du travail à « ceux qui dessinent les rochers » Les trois cartographes suisses chargés de dessiner les Alpes sont des 
témoins privilégiés des effets du changement climatique. A cause de la 
fonte des glaces, ils devraient être bientôt amenés à déplacer, sur papier, 
la frontière séparant la Confédération helvétique de l’Italie.",0
"Partage de transport sanitaire : le projet de décret prévoit 45 minutes d’attente maximum, le reste du texte inchangé La nouvelle version du texte, consultée par «Libération», précise désormais 
le délai d’attente sur le lieu de soins. Aucune distinction n’est faite 
pour exempter automatiquement les patients les plus fragiles et leur 
permettre de refuser de partager leur transport sans incidence.",0
"Conquis par Trump, boudé par Harris: Joe Rogan, le guerrier anti-woke qui influence l’Amérique  Suivi par des millions d’Américains, ce touche-à-tout est devenu 
une figure incontournable dans la fabrique de l’opinion publique. Avant 
l’élection présidentielle, Trump lui avait donné une interview visionnée 50 
millions de fois. Kamala Harris, elle, avait décliné l’invitation.",0
"Colère des agriculteurs : après les annonces du gouvernement, la coordination rurale annonce la levée du blocage du port de Bordeaux Principal syndicat mobilisé sur le terrain, la Coordination rurale a 
annoncé ce jeudi 21 novembre au soir qu’elle lèverait le blocage du port de 
commerce de Bordeaux dès vendredi matin, estimant que le Premier ministre 
avait répondu à ses revendications sur les normes européennes.",0
"Plans sociaux dans le secteur de l’automobile : le ministre de l’Industrie, Marc Ferracci, reprend sa respiration chez Toyota Le constructeur japonais, implanté à Onnaing, a fêté la sortie du 5 000 
000e véhicule assemblé en France et annoncé la titularisation à venir de 
600 salariés. Sous les yeux d’un Marc Ferracci plutôt habitué ces dernières 
semaines à commenter les suppressions programmées d’emplois.",0
"Découverte il y a cinquante ans, Lucy l’australopithèque garde encore bien des secrets 

Il y a cinquante ans, le 24 novembre, l’expédition scientifique 
« International Afar Research Expedition » faisait une découverte majeure, 
en mettant au jour le squelette de Lucy, l’australopithèque. Mondialement 
connu, ce fossile n’a pourtant pas encore livré tous ses secrets.
",0
"Flânerie Renaissance en Italie, dans les pas des Farnese, de Rome aux collines de la Tuscia GRAND  Le 24 décembre, Rome ouvrira son 27e jubilé tandis que 
les musées du Capitole accueilleront la collection Farnese. Mais c’est au 
nord du Latium, dans les collines de la Tuscia, que débute l’histoire de 
l’illustre famille, source d’inspiration pour des mécènes contemporains.",0
"Thales : enquête au Royaume-Uni et en France sur des soupçons de corruption 

Le groupe français Thalès est dans le viseur de l’autorité britannique de 
lutte contre la délinquance financière, qui a annoncé jeudi 21 novembre 
l’ouverture d’une enquête sur des soupçons de corruption, menée 
conjointement avec le Parquet national financier (PNF) côté français.
",0
"Best of beauté : Olivia Rodrigo chez Lancôme, une nouvelle collection parfumée Zara x Jo Malone… L'égérie : Olivia Rodrigo devient ambassadrice Lancôme © Presse Elle est 
l'idole des jeunes... et des moins jeunes. À seulement 21 ans, Olivia 
Rodrigo peut déjà se targuer d'avoir rempli des stades, décroché les 
récompenses les plus prestig...
Lire la suite de l'article sur Elle.fr",0
"Au procès de l’assassinat de Samuel Paty, la collégienne « emprisonnée » dans ses mensonges L’adolescente, dont le mensonge avait déclenché la campagne de haine contre 
le professeur, a été entendue comme témoin, mardi 26 novembre. Elle s’est 
évertuée à endosser l’entière responsabilité du drame pour tenter de sauver 
son père, qui encourt trente ans de réclusion criminelle.",0
"Plastique : la Corée du Sud, hôte du sommet antipollution, mais accro aux emballages En Corée du Sud, les films plastiques sont omniprésents dans 
l’alimentation, les cadeaux, les commandes en ligne… Le pays, qui accueille 
à Pusan la conférence onusienne pour un traité mondial devant mettre fin à 
la pollution plastique, est lui-même très en retard sur cette question.",0
"« Faut qu’on parle » : pour Soraya, 41 ans, « se confronter à la différence est une vraie chance » 

« Faut qu’on parle », une opération lancée par La Croix et Brut, permettra 
à des personnes qui ont des opinions diverses d’échanger le 23 novembre. 
Parmi les inscrites, Soraya, une Iséroise de 41 ans, qui se réserve le 
droit de changer d’avis, malgré des convictions bien ancrées.
",0
"Lamya Essemlali, présidente de Sea Shepherd France : «On espère que Paul Watson sera libéré d’ici Noël» Ce jeudi 21 novembre marque le quatrième mois d’emprisonnement du célèbre 
protecteur des baleines. La présidente de l’ONG de défense de 
l’environnement Sea Shepherd France détaille à «Libé» ses conditions de 
détention et décrypte les rouages politiques et diplomatiques de ce dossier.",0
"« Septembre sans attendre », une comédie jubilatoire sur la fin d’un couple 

Variation virtuose sur la comédie de remariage chère à Hollywood, le film 
de l’Espagnol Jonás Trueba (Eva en août) met en scène un couple qui, après 
quatorze ans de vie commune, décide d’organiser une fête pour célébrer sa 
séparation et mêle dans un même geste la vie et le cinéma.
",0
"Génération Psy : les jeunes lèvent le tabou sur la santé mentale Un Français sur cinq éprouve une souffrance psychique. Un mal endémique 
longtemps resté tabou. Mais la parole se libère. Sur les réseaux sociaux 
comme dans les consultations, la jeune génération n’hésite plus à aborder 
le sujet de la santé mentale. Décryptage d’une petite révolution.",0
"Comment est-on déclaré inapte au travail et quelles sont les solutions ? On vous répond Un accident ou une maladie peuvent très vite survenir et, dans le pire des 
cas, vous rendre inapte à travailler. Si cela devait malheureusement 
arriver, qui déclare ce statut ? Quelles sont les solutions qui s’offrent à 
nous si on ne peut plus reprendre notre poste ? On vous explique.",0
"La situation financière des CHU continue de se dégrader Le déficit des centres hospitaliers universitaires, non comptabilisé dans 
celui de l’Assurance-maladie, pourrait s’élever à 1,1 milliard d’euros 
en 2024, selon les dernières estimations. Et plus de la moitié rencontrent 
des difficultés majeures de financement, alertent les directeurs.",0
"« Avec l’élection de Donald Trump, l’Europe doit se projeter au-delà du cadre transatlantique » 

L’élection de Donald Trump constitue un séisme géopolitique pour le 
continent européen, exposent Hector de Rivoire et Arthur de Liedekerke. 
L’Europe doit se demander si elle peut toujours compter sur la protection 
américaine, ou si elle doit se résoudre à une autonomie stratégique.
",0
"« La réforme du brevet des collèges va aggraver les mécanismes de tri social déjà à l’œuvre » Pierre Mathiot, politiste, et Jean-Charles Ringard, ancien inspecteur 
général de l’éducation nationale, estiment, dans une tribune au « Monde », 
que la réforme du collège rendant le brevet obligatoire pour entrer en 2de 
risque de se traduire par une forte hausse du décrochage scolaire.",0
"Boycotter X, un dilemme plus complexe que prévu La question de quitter le réseau social X (ex-Twitter), propriété du 
milliardaire Musk qui a contribué à la victoire de Trump, crée un vif débat 
dans les professions intellectuelles. Révélateur de la place prépondérante 
prise par la plateforme dans la vie et la carrière de ses usagers.",0
"La Liste consacre (encore) Guy Savoy et révèle les tendances food mondiales Fermentations, cuisine à la flamme, attrait pour le végétal ou montée en 
gamme de la cuisine indienne… Au-delà du top 1 000 des restaurants les 
mieux notés au monde, l’algorithme de La Liste met en lumière les grandes 
tendances d’un secteur marqué cette année par une franche austérité.",0
"Paray-le-Monial : « Via Vitae », un trésor national volé lors d’un braquage dans un musée 

La pièce maîtresse du musée du Hiéron, à Paray-le-Monial (Saône-et-Loire), 
a été volée lors d’un braquage, a-t-on appris vendredi 22 novembre. Les 
malfaiteurs ont découpé le socle de « Via Vitae », une statuette d’or et 
d’ivoire retraçant la vie de Jésus, afin de pouvoir l’emporter.
",0
"Au Pakistan, l’opposition dispersée après sa démonstration de force à Islamabad Mardi soir, Imran Khan appelait depuis sa prison ses soutiens à converger 
vers le quartier gouvernemental de la capitale pakistanaise, D-Chowk, à 
l’issue d’une journée marquée par la mort de quatre paramilitaires, 
renversés selon les autorités, par des manifestants à bord d’un véhicule.",0
"La boxeuse Imane Khelif, icône LGBT+ malgré elle Championne olympique dans sa catégorie depuis les Jeux de Paris, la 
sportive algérienne est poursuivie par une rumeur mettant en doute sa 
féminité. Dans ce podcast, Gaspard Dhellemmes, journaliste à « M Le 
magazine du Monde », raconte l’histoire et les multiples visages de la 
sportive.",0
"Rugby : l’Australien Brett Robinson élu à la présidence de la Fédération internationale 

L’Australien Brett Robinson a été élu jeudi 14 novembre président de World 
Rugby, la fédération internationale. Avec 27 voix contre 25, il a devancé 
de peu Abdelatif Benazzi, l’ancien capitaine du XV de France. Le nouveau 
président a promis rendre le jeu plus spectaculaire et rapide.
",0
"UE-Mercosur : « Cet accord anachronique sacrifie l’environnement sur l’autel du profit » 

Alors que la Commission européenne entend signer rapidement son accord de 
libre-échange avec le Mercosur, le député écologiste Benoît Biteau appelle 
la France à s’y opposer. Il craint ses conséquences environnementales 
désastreuses, en particulier à travers la déforestation importée.
",0
"Les nouveaux Naviexpress vont coûter cher aux partenaires français Chaque année, Thonon Agglo et la communauté de communes Pays d’Evian vallée 
d’Abondance participent financièrement au déficit d’exploitation des 
navettes lacustres transfrontalières de la CGN. Un montant encore en 
augmentation cette année en raison de l’arrivée des nouveaux Naviexpress.",0
"Pourquoi Nétanyahou voulait évincer la France du possible accord de cessez-le-feu au Liban Un cessez-le-feu imminent est attendu entre Tsahal et le Hezbollah, mais 
Israël a longtemps insisté pour que la France ne soit pas membre du comité 
international chargé de surveiller l’accord. En cause, une série 
d’agissements français considérés comme hostiles par l’exécutif israélien.",0
"Des députés et une ex-ministre victimes de piratage, signe inquiétant des failles dans la cybersécurité du personnel politique Une attaque à l’hameçonnage par la messagerie Telegram, mercredi 
20 novembre, a piégé une ancienne ministre macroniste, plusieurs élus et 
des personnels de l’Assemblée nationale, révélant la vulnérabilité des 
responsables politiques face à la cybercriminalité. Une enquête a été 
ouverte.",0
"Avec la Coupe Davis 2024 à Malaga, Rafael Nadal fait ses adieux au tennis : «Mon heure est venue et je l’accepte comme telle» Joueur hors-norme et roi incontesté de la terre battue, «Rafa» tirera sa 
révérence à l’issue de la Coupe Davis, dont les phases finales se jouent 
cette semaine à Malaga. Mardi 19 novembre, les médias espagnols l’ont 
annoncé partant pour le premier simple de son équipe, face aux Pays-Bas.",0
"« Faut qu’on parle » : pour Xavier, 56 ans, « la vie est une affaire de rencontre » 

La Croix et le média Brut lancent l’opération « Faut qu’on parle », qui 
permet à des personnes qui ont des opinions divergentes d’échanger, en 
vrai, durant une heure ou deux. Inscrit à l’événement du 23 novembre, 
Xavier, un Perpignanais, a saisi l’opportunité de rencontrer un inconnu.
",0
"Un cessez-le-feu entre Israël et le Hezbollah dans les prochaines heures ? Un vent d’optimisme diplomatique porte à croire que l’État hébreu et le 
parti chiite pourraient très bientôt s’accorder sur une trêve des 
hostilités de deux mois. Le cabinet de sécurité présidé par Benyamin 
Nétanyahou se réunit dans les prochaines heures pour examiner ce projet 
d’accord.",0
"L’interdiction d’une conférence de Rima Hassan à Strasbourg jugée « illégale » Les juges ont considéré, mardi, que le refus du président de l’université 
d’autoriser la tenue de cette conférence en présence de l’eurodéputée (La 
France insoumise) Rima Hassan « portait atteinte à la liberté 
d’expression ». L’établissement a annoncé faire appel devant le Conseil 
d’Etat.",0
"Amsterdam : Sky News a-t-il supprimé un reportage qui soulignait les violences des supporteurs du Maccabi Tel-Aviv ? Le média britannique a remplacé une première version d’un sujet consacré à 
l’agression de supporters de foot israéliens aux Pays-Bas, dans la nuit du 
7 au 8 novembre. La journaliste rapportait les violences et chants racistes 
perpétrés en amont par des «ultras d’extrême droite israéliens».",0
"Soumission chimique : des kits de détection remboursés à titre expérimental 

En plein procès des viols de Mazan, le premier ministre Michel Barnier a 
annoncé lundi 25 novembre 2024 le remboursement de kits de détection de 
soumission chimique « du lendemain ». Une expérimentation qui se fera 
« dans plusieurs départements » et selon un calendrier encore à définir.
",0
"Une auto-école de Marseille visée par des tirs : la piste de la tentative d’intimidation privilégiée Les enquêteurs privilégient la piste de la tentative d’intimidation après 
que des coups de feu ont été tirés vers une auto-école de Marseille 
(Bouches-du-Rhône) dans la nuit du dimanche 24 au lundi 25 novembre. 
L’établissement avait déjà été la cible d’un incendie plus tôt dans la 
semaine.",0
"Les avocats, des influenceurs comme les autres ? Stories polémiques, décryptages juridiques sur TikTok ou tweets 
provocateurs : de Sarah Saldmann à Nadia El Bouroumi, les avocats 
s’exposent de plus en plus sur les réseaux sociaux, allant parfois jusqu’à 
adopter les codes des influenceurs. Un mélange des genres qui génère des 
crispations.",0
"Option «silence» chez le coiffeur : le fond de l’hair effraie Au Japon, il est possible, au moment de prendre un rendez-vous, de choisir 
un échange minimal ou inexistant. Mais ce gage de tranquillité, qui s’étend 
à d’autres services, réduit encore nos interactions les plus basiques et 
ramène ceux qui nous servent à une dimension uniquement utilitaire.",0
"A69 : à l’audience des recours en annulation, les arguments pro-autoroute démontés Le tribunal administratif s’est penché ce lundi 25 novembre sur le fond du 
dossier environnemental de l’autoroute Castres-Toulouse. La rapporteure 
publique a confirmé qu’elle ne voyait pas de «raison impérative d’intérêt 
public majeur» et la défense a mis en avant des arguments économiques.",0
"Course «la plus sale de l’histoire» aux JO de Londres 2012 : l’athlète russe Tatyana Tomashova privée de médaille à son tour L’Unité d’intégrité de l’athlétisme a annoncé ce mardi 19 novembre la 
disqualification très tardive de l’athlète russe, accusée de dopage, de la 
finale olympique du 1 500 mètres à Londres en 2012. En douze ans, elle est 
la cinquième participante à cette course à écoper d’une telle sanction.",0
"« Je l’aime » : Scarlett Johansson évoque son histoire d’amour avec Colin Jost Scarlett Johansson est plus amoureuse que jamais. Ce mardi 26 novembre, 
l'actrice Scarlett Johansson est apparue sur "" Live with Kelly et Mark "". 
L'occasion pour elle d'évoquer son amour pour Colin Jost avec qui elle 
partage sa vie. Après avoir expl...
Lire la suite de l'article sur Elle.fr",0
"Jennifer Aniston célèbre son traditionnel « Friendsgiving » avec Courteney Cox Jennifer Aniston et son annuel "" Friendsgiving "". Ce lundi 25 novembre, 
l'actrice vedette de la sitcom "" Friends "" a décidé de partager sur son 
compte Instagram un aperçu de sa soirée de fête entre amis qu'elle organise 
tous les ans.À seulement deux...
Lire la suite de l'article sur Elle.fr",0
"À 85 ans, cette grand-mère de Zambie est devenue une icône de style En tutu en tulle orange et maillot de football américain, robe à sequins 
bleutés et manchettes argentées, ou encore en caftan rose bonbon, gants 
d'opéra turquoise et imposantes lunettes rondes... Margret Chola, 
"" Legendary Glamma "" sur Instagram, po...
Lire la suite de l'article sur Elle.fr",0
"Marine Le Pen rattrapée par ses vieux démons Depuis les réquisitions déposées contre Marine Le Pen dans le cadre du 
procès pour détournement de millions d’euros européens, la triple candidate 
présidentielle du Rassemblement national attaque frontalement la justice. 
La dédiabolisation appartient ainsi au passé, selon ce journal suisse.",0
"Education à la sexualité à l’école : offensive conservatrice contre le premier projet de programme Des associations mènent campagne contre un dispositif qui n’est pas encore 
entré en vigueur et qui fait l’objet d’un très large consensus dans la 
communauté éducative. La ministre de l’éducation nationale, Anne Genetet, 
défend ce programme, mais insiste sur les consultations encore en cours.",0
"Aurélie Trouvé, députée LFI : « Pour sauvegarder l’agriculture familiale, il faut reréguler les prix, les échanges et la production » Une bifurcation économique, sociale et écologique est nécessaire pour aider 
les exploitations françaises dans l’élevage, l’agriculture bio, la 
production de céréales et de fruits et légumes, plaide, dans une tribune au 
« Monde », l’élue de Seine-Saint-Denis, ingénieure agronome de formation.",0
"Le rapporteur public conclut à l’absence d’intérêt public majeur pour l’A69 : «Ça légitime tout ce qu’on dit depuis des mois» Dans son avis dont le contenu a été dévoilé ce ce mercredi 20 novembre, le 
rapporteur public du tribunal administratif préconise l’annulation de 
l’autorisation environnementale de l’autoroute devant relier Toulouse à 
Castres. Si les juges suivaient cet avis, le chantier pourrait être annulé.",0
"Éducation : le brevet obligatoire pour le passage en seconde est-il pertinent ? 

La ministre de l’éducation nationale, Anne Genetet, a présenté mardi 
12 novembre une série de réformes largement inspirées du « choc des 
savoirs » lancé par Gabriel Attal fin 2023. Elle confirme notamment que 
l’obtention du brevet sera nécessaire pour passer en seconde, à partir de 
2027.
",0
"Sydney Sweeney adopte la coloration blond foncé parfaite pour l’hiver Chaque année, les saisons vont et viennent avec leur lot de tendances 
beauté. Si l'été, nous sommes nombreuses à vouloir afficher une chevelure 
un peu plus claire que le reste de l'année, a contrario, la saison 
hivernale est le moment opportun pour s...
Lire la suite de l'article sur Elle.fr",0
"Chic et sophistiqué : le caban est le manteau phare des adeptes du quiet luxury Le caban, cette pièce emblématique du vestiaire hivernal, fait son grand 
retour cette saison en s'imposant comme le manteau incontournable des 
adeptes du quiet luxury. Après plusieurs années de domination des manteaux 
longs et structurés, la silhouet...
Lire la suite de l'article sur Elle.fr",0
"Peaux matures : l’astuce d’un maquilleur pour appliquer l’anticernes sans marquer les ridules Pour camoufler les cernes et les petites imperfections, l'anticernes n'a 
pas son pareil. En effet, ce dernier fait partie des produits de 
prédilection d'un bon nombre de femmes et se retrouve dans les vanity du 
monde entier. Mais voilà. Pour tirer un...
Lire la suite de l'article sur Elle.fr",0
"« Ils ne sont pas nés avec la vie privée » : Angelina Jolie se confie sur la notoriété de ses enfants Une famille sous le feu des projecteurs. Angelina Jolie est à l'affiche du 
biopic sur Maria Callas, une figure importante de l'opéra. Ce long-métrage 
réalisé par Pablo Larraín sera à découvrir à partir du 5 février 2025 dans 
les salles françaises. De...
Lire la suite de l'article sur Elle.fr",0
"Vivian Jenna Wilson, la fille d'Elon Musk qui veut quitter les États-Unis ""Je ne vois pas mon avenir aux États-Unis. "" C'est par ses mots que Vivian 
Jenna Wilson a indiqué sa volonté de quitter son pays à la suite de la 
victoire de Donald Trump à l'élection présidentielle américaine. Or, cette 
femme de 20 ans n'est pas n'i...
Lire la suite de l'article sur Elle.fr",0
