texte,label 
"Des écrans en fusion Avec des tablettes qui monopolisent l’attention, on pouvait être inquiet 
pour l’avenir du notebook. Et pourtant en cette fin d’année, la tendance 
s’inverse et les ordinateurs sont revenus sur le devant de la scène...",0
"Emil Ferris roule sa bille Deuxième volet, et deuxième succès, de «Moi, ce que j’aime, c’est les 
monstres», le colossal roman graphique de l’autrice américaine.",0
"Neil Gaiman, le mur du songe L’auteur anglais, passionné d’imaginaire, a écrit pour sa femme un roman 
sensible sur l’enfance devenu un best-seller.",0
"Pierre Lottin, sur la brèche Mélomane et militariste de gauche, l’acteur omniprésent abonné aux 
personnages rêches est à l’affiche du film «En fanfare».",0
"Léa Salamé, timbale libanaise A 35 ans, la journaliste née à Beyrouth frémit à France Inter et chez 
Ruquier. Deux attentats ont ponctué sa vie d’avant.",0
"Pollution plastique : urgence 

Les délégués de 175 pays sont réunis cette semaine à Busan, en Corée du 
Sud, pour négocier un traité international contraignant sur la pollution 
plastique.
",0
"Antoon Krings, bêtes de gloire Mireille l’abeille ou Loulou le pou ont vu le jour sous la plume de 
l’auteur et dessinateur jeunesse, à la tête depuis trente ans d’un 
bestiaire coloré et innocent.",0
"John Malkovich. Le prince Malko Jouant un Casanova finissant, l’acteur-réalisateur-créateur de mode et 
chanteur d’opéra, s’affiche heureux de vivre.",0
"Bernard Pruvost – Grand Quinquin Rencontre appréciée avec l’attachant acteur non professionnel qui a joué le 
commandant dans «P’tit Quinquin», la série d’Arte.",0
"Enchanté Julia, groove vibrations Une scène soul en français est en train d’éclore. Le premier album de 
l’autrice-compositrice-interprète le prouve de la plus élégante des 
manières.",0
"Boualem Sansal, esprit de lumière L’écrivain algérien, ancien ingénieur et haut fonctionnaire, poursuit 
inlassablement sa lutte solitaire contre l’islamisme et un pouvoir 
compromis.",0
"Puis-je encore rêver d’Amérique ? Notre journaliste, qui rêve de New York depuis l’enfance, s’interroge sur 
le désamour qui pourrait naître après les résultats de l’élection 
présidentielle américaine.",0
"Trois cartes de voeux pour l’Elysée Présidence. Quelle année 2006 pour Jacques Chirac ? Des personnalités lui 
adressent leurs souhaits via «Libération».",0
"Marine Le Pen, l’improbable martyre Cette semaine, dans notre newsletter consacrée à ce que la presse étrangère 
écrit de meilleur et de pire sur l’Hexagone : justice et complot au 
Rassemblement national.",0
"Conchita Wurst, la cantatrice barbue Sur scène au Crazy Horse, ce chanteur travesti, gagnant de l’Eurovision, 
réinvente le stéréotype de la femme à barbe.",0
"Les beaux frissons du cinéma français A l’image d’« Animale », d’Emma Benestan, les productions françaises n’ont 
plus peur de se confronter à l’horreur, au paranormal ou au fantastique.",0
"« Last Dance ! », pas de deux en solo 

Dans cette comédie tendre, un septuagénaire se retrouve à la mort de son 
épouse au cœur d’un spectacle de danse contemporaine en raison d’un serment 
échangé avec elle.
",0
"Théâtre : au Lucernaire, Bach forever 

Quatre femmes dans le vent de la musique irrésistible de Jean-Sébastien 
Bach charment et réjouissent le public du Lucernaire, à Paris, jusqu’au 
12 janvier 2025. Un spectacle idéal à l’approche des fêtes.
",0
"Gaëlle Bourges. Que danse le regard nu Passée par le strip-tease, cette danseuse et chorégraphe de 47 ans 
expérimente la nudité des corps et le désir tenu à l’œil.",0
"Nana Mouskouri, elle ne regrecque rien Longs cheveux de jais et immuables lunettes carrées, la chanteuse née en 
Grèce repart en tournée pour fêter ses 80 ans. .",0
"Sommes-nous tous des mauvais perdants ? Mauvaise perdante, notre journaliste s’interroge sur ce que le jeu dit de 
notre personnalité, et surtout de celles des autres.",0
"Christian Pellerin, l’atour de la Défense Flamboyant et détesté, ruiné puis revenu aux affaires, ce promoteur 
immobilier a construit le quartier de la Défense.",0
"Comment parler de la mort à ses enfants ? L’esquive ne pouvant pas durer indéfiniment, notre journaliste s’interroge 
sur la manière d’évoquer avec ses enfants la disparition d’un proche.",0
"Fin de vie : où en est le projet de loi ? 

Le texte d’émanation gouvernementale, qui devrait légaliser sous conditions 
« l’aide active à mourir », doit être remis fin septembre au président 
Macron.
",0
"Les îles que la France ne veut pas lâcher Cette semaine, dans notre newsletter consacrée à ce que la presse étrangère 
écrit de meilleur et de pire sur l’Hexagone : la Nouvelle-Calédonie en 
grande détresse.",0
"Budget 2025 : et soudain, le Sénat exista Bien plus conciliants que les députés, les sénateurs se réjouissent d’être 
courtisés par l’exécutif alors qu’ils ont entamé, lundi 25 novembre, 
l’examen du projet de loi de finances.",0
"Anne-Laure Compoint. Spécialiste du poulet Jeune, jolie et accrocheuse, cette avocate s’est spécialisée dans la 
défense des policiers vifs de la gâchette et des flics ripoux.",0
"Excenevex : un incendie détruit une maison Un couple d’une soixantaine d’années résidant à Excenevex a vu sa maison 
détruite par les flammes ce samedi 22 novembre, vers 18 heures.",0
"Alaa El Aswany, si l’Égypte m’était contée 

Malgré son exil aux États-Unis, l’auteur du très populaire L’Immeuble 
Yacoubian garde un contact privilégié avec l’Égypte, matière première de 
ses récits, à travers lesquels il vise le « plaisir » de lire.
",0
"Nicolas Offenstadt, la mémoire dans la peau Spécialiste de la guerre 1914-1918, cet historien revendique une identité 
française mouvante et souhaite des débats citoyens.",0
"Justin Morin entre roman noir et true crime Dans «On n’est plus des gens normaux», le journaliste s’empare d’un 
terrible fait divers qu’il retrace et tente de décrypter en comblant les 
trous par la fiction.",0
"Pierre Palmade : le procès après la tempête L’humoriste de 56 ans comparaît ce mercredi 20 novembre au tribunal 
correctionnel de Melun pour blessures involontaires sous l’emprise de 
stupéfiants, il encourt jusqu’à 14 ans d’emprisonnement.",0
"Prime de Noël : la date finalement repoussée D’abord annoncée pour le 13 décembre, la prime exceptionnelle de fin 
d’année sera finalement versée dès le 17 décembre, a annoncé le 
gouvernement ce mardi 26 novembre.",0
"Visas étudiants : quand les portes se ferment Le “Times Higher Education” révèle que les nouvelles politiques de visa 
empêchent de plus en plus d’étudiants de réaliser leur rêve d’étudier à 
l’étranger, surtout dans les pays anglophones.",0
"À propos des cellules-souches hématopoïétiques 

Jean-René Binet est professeur de droit privé à l’université Rennes 1 et 
membre honoraire de l’Institut universitaire de France.
",0
"Tennis : Andy Murray entraînera Novak Djokovic Le Serbe, qui a connu une saison 2024 difficile, a recruté le Britannique, 
qui avait mis un terme à sa carrière cet été à l’occasion des Jeux 
olympiques de Paris",0
"Festival : OVNi survole Nice et la Côte d’Azur Mosaïque d’écrans, projection immersive… Exclusivement dédié à l’art vidéo, 
l’événement azuréen célèbre dans une trentaine de lieux dix ans d’activité 
défricheuse.",0
"La rappeuse Shay enchaîne les shows chatoyants Pour ses débuts sur scène, l’artiste belge de 32 ans a imaginé un spectacle 
différent à chaque concert. Un cycle qui s’est ouvert à l’Olympia et se 
poursuit les 21 et 22 novembre au Zénith de Paris.",0
"Les 3 étapes pour immigrer facilement au Québec Selon l'Accord Canada-Québec, le Québec dispose du pouvoir de sélectionner 
des ressortissants étrangers destinés à s'y installer durablement.",0
"Quand un don est taxé trois décennies plus tard Un tribunal juge que « Le Concert », de Gerrit van Honthorst, a fait 
l’objet d’un don manuel, dont la révélation, même forcée, doit générer une 
taxation.",0
"S’expatrier pour travailler moins et vivre mieux Selon une enquête relayée par le magazine allemand “Telepolis”, un tiers 
des salariés dans le monde se disent prêts à quitter leur pays pour une 
meilleure qualité de vie, notamment au travail.",0
"Pourquoi les hommes ne font-ils pas les valises ? Notre journaliste s’interroge sur une curiosité : pourquoi une partie de 
l’humanité peine à rassembler ses affaires, ou celles de sa progéniture, au 
moment de partir quelques jours ?",0
"Au Brésil, les Français redécouvrent les haricots Les haricots secs sont l’une des bases de l’alimentation des Brésiliens. 
Une excellente occasion pour les Français de redécouvrir cette légumineuse, 
en dégustant une bonne “feijoada” par exemple.",0
"Des soirées sans portable pour sortir de sa bulle Venu des Pays-Bas, le Offline Club remporte un franc succès auprès des 
trentenaires saturés d’écrans. Son concept ? Organiser des événements 
festifs garantis sans smartphone, pour satisfaire leur soif de déconnexion.",0
"Climat : comment faire face à la montée des eaux ? Pour se prémunir contre cette conséquence du changement climatique, il est 
impératif de prendre des décisions rapidement, prévient le chercheur Gonéri 
Le Cozannet dans cet épisode du podcast « Chaleur humaine ».",0
"Le lumbersexuel, nouvelle espèce qui envoie du bois C'est le nouveau mot-concept à la mode. On le trouve partout pour désigner 
un look barbe et chemise de bûcheron, au-delà du hipster.",0
"Un “miracle” nommé Brest face au grand FC Barcelone La presse espagnole retrace la fabuleuse odyssée de la “surprise” de ce 
début de saison en Ligue des champions. Le “modeste” Stade brestois 29, 
toujours invaincu, se présente à Barcelone mardi 26 novembre.",0
"Bordeaux : les lauréats de l’Adaptathon sont connus Ce vendredi 22 novembre, cinq associations ont été distinguées dans le 
cadre de l’Adaptathon, qui met en valeur des projets singuliers favorisant 
l’accès et le maintien dans l’emploi des personnes en situation",0
"Insee : plus on est favorisé, plus on est en couple 

Plus le niveau d’éducation et d’emploi est élevé, plus on vit en couple et 
de préférence avec quelqu’un du même milieu que soi, relève l’Insee dans 
son «  social » de la France, publié jeudi 23 novembre.
",0
"Le Canada peine à retenir ses immigrants francophones L’immigration francophone au Canada est loin d’être un succès. Une nouvelle 
étude montre que l’Ontario et le Québec perdent le tiers des nouveaux venus 
d’expression française. Explications.",0
"Florence Thune, patronne du Sidaction : séro-combative La discrète patronne du Sidaction, porteuse du VIH depuis l’âge de 30 ans, 
a su garder intacts ses idéaux de jeunesse.",0
"Bourse : l’engouement pour les fonds climat s’essouffle Les produits financiers qui misent sur des entreprises les mieux préparées 
à une transition bas carbone devraient connaître une décollecte en 2024.",0
"A la foire FAB Paris, des antiquités et des trouvailles Au Grand Palais, jusqu’au 27 novembre, la manifestation qui a remplacé la 
Biennale des antiquaires présente aussi bien de la joaillerie que du 
mobilier, des tableaux ou des livres rares.",0
"Comment partir sur de bonnes bases financières à 20 ans Se connaître, maîtriser quelques concepts, savoir établir un budget… autant 
de réflexes qui permettent d’aborder le plus sereinement possible les 
questions d’argent quand on se lance dans la vie.",0
"Baromètre Unédic sur le chômage, je t’aime moi non plus Publié ce mardi 26 novembre, le nouveau baromètre de l’Unédic se penche sur 
le chômage. Si les chiffres révèlent un attachement plus grand au régime 
des allocations, certaines fausses idées et les préjugés perdurent.",0
"Top des ventes de livres : la BD dégaine avant les fêtes «Lucky Luke», «Blake et Mortimer» et «Nestor Burma» dévalisent le 
classement. Chaque samedi, le point sur les ouvrages préférés du public.",0
"Anne Genetet était l’invitée de « Questions politiques » La ministre de l’éducation nationale était l’invitée de France Inter, de 
France Télévisions et du « Monde » ce dimanche, de midi à 13 heures.",0
"En mer Baltique, le mystère des câbles sous-marins coupés L’hypothèse d’un sabotage est privilégiée après que deux 
câbles de télécommunication ont été sectionnés dimanche et lundi.",0
"Thonon-les-Bains : deux femmes renversées par une voiture Mardi 26 novembre, deux femmes ont été renversées alors qu’elles 
traversaient la route, chemin de Ronde, à Thonon. L’une d’elles est 
grièvement blessée.",0
"PER: ces astuces pour alléger vos impôts à moindres frais  Il ne reste que quelques semaines pour défiscaliser vos 
revenus à travers un plan d’épargne retraite. Voici nos conseils pour 
économiser plus d’impôts sans douleur.",0
"À Kiev, la fébrile attente de la prochaine escalade russe Après l’évolution de la doctrine d’emploi russe édictée par 
Vladimir Poutine, les Ukrainiens redoutent des frappes nucléaires tactiques 
sur les grandes villes du pays.",0
"Colson Whitehead, comme un taxi dans la nuit new-yorkaise Avec «la Règle du crime», le romancier américain poursuit, dans l’Amérique 
des années 70, une trilogie baignée de magouilles, mensonges, braquages, 
nuits de folie et turpitudes politiques.",0
"L’enfance se serait prolongée il y a 1,8 million d’années L’analyse des dents d’un fossile du genre « Homo », découvert en Géorgie, 
suggère un passage à l’âge adulte plus tardif, facilitant l’évolution du 
cerveau. Une interprétation qui fait débat.",0
"L’EM Lyon quitte Ecully et fait son grand retour dans Lyon Situé dans le quartier de Gerland, ce campus doit permettre à la 4e école 
française d’accueillir 11.000 étudiants en 2028.",0
"« Le Processus de paix », l’amour à l’épreuve du quotidien 

Cette comédie rythmée, signée Ilan Klipper et Camille Chamoux, dessine les 
tentatives d’une sortie de crise pour un couple qui se déchire autant qu’il 
s’aime.
",0
"« En fanfare » d’Emmanuel Courcol, une fraternité musicale Emmanuel Courcol place la musique et la solidarité au cœur de son nouveau 
film, magnifié par un collectif de comédiens attachants. Sans angélisme, 
les trésors de la fraternité y sont affectueusement célébrés.",0
"Paulin Césari: «Notre-Dame de Paris: et Dieu dans tout ça?» On ne peut exclure qu’il soit absent. Qu’il refuse d’être 
un décorum. Un accessoire. Un idiot utile du spectacle.",0
"Algérie : le prix Goncourt de Kamel Daoud dans la tourmente 

Deux plaintes ont été déposées contre l’auteur franco-algérien qui, depuis 
la publication de son roman Houris, fait l’objet d’une violente polémique 
dans son pays.
",0
"Les mauvaises herbes sont-elles devenues “incontrôlables” ? L’utilisation massive d’herbicides a fini par sélectionner des “super 
mauvaises herbes” résistantes. Celles-ci envahissent les champs… Et la une 
de la “MIT Technology Review”.",0
"Crise industrielle : en Isère, la crainte de l’effet domino 

Alors que l’usine de Vencorex, au sud de Grenoble, est menacée de 
fermeture, l’inquiétude gagne tout l’écosystème de l’entreprise, du bassin 
d’emploi local à la filière chimique.
",0
"Une lignée de grippe a disparu pendant la pandémie de Covid Les restrictions sanitaires de 2020 ont entraîné une chute spectaculaire 
des cas de grippe, provoquant la disparition de la lignée B/Yamagata. Cela 
peut-il changer le déroulement des épidémies de grippe ?",0
"L’écrivain Boualem Sansal aux prises avec le régime algérien Virulent critique du pouvoir, le romancier et essayiste franco-algérien a 
disparu à Alger depuis samedi dernier. Il serait aux mains des services de 
sécurité et risquerait la prison.",0
"Rallye automobile : Thierry Neuville enfin champion du monde À 36 ans, le pilote belge a décroché, dimanche au Japon, le titre mondial 
après lequel il courait depuis dix ans. Vainqueur du rallye, le Gallois 
Elfyn Evans a permis à Toyota de sauver l’honneur sur ses terres.",0
"Pierre Palmade condamné à cinq ans de prison dont deux ferme Après un feuilleton judiciaire mêlant drame routier et toxicomanie qui a 
défrayé la chronique pendant près de deux ans, le tribunal a condamné, 
mercredi 20 novembre, l’humoriste à cinq ans de prison dont deux ferme.",0
"Lettre au wokisme qui existe bel et bien, par Luc Le Vaillant Tentative de définition de cette bien-pensance dite progressiste qui, après 
avoir facilité l’élection de Trump, pousse la gauche française à dénoncer 
et à proscrire.",0
"Dans son dernier rapport, l’IGPN veut faire dans la pédagogie Le nombre d’enquêtes menées par l’inspection générale de la police 
nationale portant sur des interventions policières sur la voie publique est 
en légère baisse en 2023.",0
"Les rapports contradictoires des jeunes adultes avec l’argent Les comportements financiers des jeunes majeurs détonnent à plusieurs 
égards et déroutent par leurs paradoxes. L’histoire des 18-30 ans avec 
l’argent est marquée par les troubles du temps.",0
"« Nous, les Leroy », une famille au bord de la crise de nerfs 

Dans ce film récompensé du grand prix du festival de l’Alpe d’Huez, un 
homme entraîne ses enfants et sa femme qui veut divorcer dans un road trip 
familial sur les lieux clés de leur histoire.
",0
"Aux Philippines, le combat des chefs vire aux menaces de mort Le président Ferdinand Marcos Jr. et sa vice-présidente, Sara Duterte, sont 
à couteaux tirés. La seconde a menacé le premier d’assassinat, ce qui lui 
vaut d’être convoquée devant la police pour s’expliquer.",0
"Cluses : le festival électro Pharaonic aura bien lieu en 2025 Après une annulation de l’édition 2024, le festival sera de retour l’année 
prochaine. La dernière édition, qui s’était déroulée en 2023 à Cluses, 
avait rassemblé plus de 10 000 spectateurs au Parvis des Esserts.",0
"Sébastien Jumel et Geoffroy de la Tousche, Clochemerle heureux Le maire communiste et le curé de Dieppe sont allés voir le pape en signe 
d’amitié entre deux «paroisses» réconciliées.",0
"« Iris », sur Canal+ : une institutrice gaffeuse et attachante Doria Tillier s’amuse dans la peau du personnage principal d’une série 
qu’elle a créée, une femme à l’honnêteté brutale.",0
"« Les Misérables », un retour en majesté au Théâtre du Châtelet Dans une mise en scène très réussie de Ladislas Chollat, la comédie 
musicale, d’après l’œuvre de Victor Hugo, enthousiasme par son ancrage 
actuel et son casting impeccable.",0
"Antoine Armand, le ministre macroniste qui défie Michel Barnier  - En s’opposant au gouvernement sur la hausse des cotisations 
patronales, le ministre de l’Économie de 33 ans a ajouté un nouvel épisode 
à ses relations fraîches avec le premier ministre.",0
"Cinq entreprises haut-savoyardes iront au CES de Las Vegas 2025 La région Auvergne-Rhône-Alpes a dévoilé sa délégation au Consumer 
Electronics Show (CES) de Las Vegas 2025. Près de 70 start-up régionales 
seront présentes, dont cinq sont implantées en Haute-Savoie.",0
"La plateforme du masculiniste Andrew Tate victime d’un piratage Les identifiants de quelque 800 000 utilisateurs, passés et présents, ont 
été dérobés, ainsi qu’un historique des canaux de discussion internes de 
The Real World, la plateforme communautaire de l’influenceur.",0
"Homéopathie : 145 emplois pourraient être supprimés chez Boiron 

Le laboratoire Boiron, ébranlé par le déremboursement de l’homéopathie en 
France, a annoncé jeudi 21 novembre un nouveau plan de restructuration, 
entraînant la possible suppression de 145 postes en France.
",0
"Immobilier hors de prix et écoles saturées : Dubaï sous pression En pleine expansion, Dubaï attire millionnaires et expatriés à un rythme 
effréné. Toutefois, le site américain “Bloomberg” souligne que cette 
popularité a un coût.",0
"Les amis de vos amis façonnent aussi votre microbiote intestinal La composition du microbiote intestinal dépend de différents paramètres que 
les chercheurs essayent d’identifier. Parmi eux figurent nos relations 
sociales au second degré.",0
"Levée de fonds record pour la future capsule spatiale européenne The Exploration Company a collecté 150 millions d’euros, un financement 
auquel participent les Etats français et allemand en raison de la dimension 
stratégique de ce projet pour l’Europe.",0
"A Toulouse, les étudiants questionnent l’avenir de l’agriculture A l’invitation du sociologue François Purseigle, spécialiste du monde 
agricole, quelque 300 étudiants ont pu dialoguer, mercredi 20 novembre, 
avec des représentants du secteur de l’élevage.",0
"Ce set de 3 bagages Delsey Paris est à -30% pour le Black Friday Avec ce set de trois bagages Delsey, vous disposez de tous les bagages dont 
vous avez besoin selon la durée et la destination. Ne ratez pas l’offre 
spéciale Black Friday pour vous le procurer.",0
"Musique classique : pour Noël, remettre Mozart en pleine lumière 

Il est déjà temps de penser aux cadeaux de Noël. Pour les mélomanes et 
toutes les oreilles en quête de beauté, voici quelques albums consacrés à 
Mozart qui s’imposent dans nos discothèques.
",0
"Fuir le Royaume-Uni pour Dubaï : le rêve des jeunes britanniques L’expatriation, en particulier à Dubaï, attire de plus en plus les jeunes 
Britanniques. “The Times” explique que cela en dit beaucoup sur le déclin 
du Royaume-Uni et que le pays devrait se remettre en question.",0
"L’écureuil Peanut, icône de la campagne présidentielle américaine Le rongeur vedette d’Instagram euthanasié pour des raisons sanitaires 
continue de faire parler de lui. Elon Musk l’a érigé en martyr des 
aberrations de l’administration dont il veut la peau.",0
"Amour ou emprise ? Comment éviter le piège d’une relation toxique Difficile d’y voir clair lorsqu’on est aveuglé par le sentiment amoureux. 
Il existe pourtant des signes d’alerte, dès le début d’une relation, pour 
démasquer les personnalités perverses narcissiques.",0
"Après l’«islamo-gauchisme», vous prendrez bien un peu de «wokisme» Jean-Michel Blanquer annonce la création d’un «laboratoire républicain» 
pour lutter contre l’idéologie «woke» et la «cancel culture».",0
"Rachida Dati ne sait pas ce qu’est le wokisme mais elle est contre La ministre de la Culture l’a admis en commission d’enquête : elle n’a pas 
de «définition précise» de ce qu’est le wokisme. Mais elle l’assimile à de 
la censure. C’est pratique.",0
"Olivier Aptel (PSB) : « Nous rejoignons le quartier latin en 2025 » L’école de commerce parisienne occupera en septembre prochain le campus 
Claude Bernard, dans les anciens bâtiments laissés par l’Agro, au cœur du 
Ve arrondissement.",0
"Les photos sensuelles de Kate Moss pour sa nouvelle collection Zara Pour la première fois de sa carrière, le mannequin de 50 ans signe une 
collection pour l’enseigne de prêt-à-porter. Et s’offre pour l’occasion une 
séance photo ultra-sensuelle.",0
"« L’Amante anglaise » : trois raisons d’y admirer Sandrine Bonnaire 

Très rare au théâtre, la comédienne y excelle dans un texte vertigineux de 
Marguerite Duras, qui interroge les raisons d’un meurtre sordide. Une 
célébration exigeante de la parole et de l’écoute.
",0
"Sport : sur le bord des terrains, la pression exacerbée des parents 

De nombreux clubs de sport redoutent l’attitude décomplexée et autoritaire 
de certains parents sur les jeunes sportifs et le personnel bénévole, tant 
ils sont persuadés du potentiel de leur enfant.
",0
"L’enseignement privé musulman demande « une égalité de traitement » 

La Fédération nationale de l’Enseignement privé musulman (FNEM) a plaidé 
mardi 22 octobre pour une « égalité de traitement » avec les autres 
réseaux. Elle regrette une « offre réduite » d’écoles musulmanes.
",0
"Ces 3 desserts de Noël peuvent être préparés des semaines à l’avance Une bûche, un vacherin et un nougat glacé... Pour un réveillon sans tracas, 
voici trois desserts parfaits pour les fêtes, à préparer bien en amont.",0
"Portée par Jannik Sinner, l’Italie conserve son titre en Coupe Davis Tenante du titre, l’Italie s’est imposée contre les Pays-Bas en finale de 
la compétition, dimanche à Malaga (Espagne). Le dernier épisode d’une année 
riche en succès pour le numéro un mondial, Jannik Sinner.",0
"La mort d’Yves Frégnac, explorateur passionné des mystères du cerveau Le chercheur en neurosciences, fervent défenseur d’une vision intégrative 
de notre « machine à penser », est mort à 73 ans.",0
"Le Collège des ingénieurs, un MBA ultrasélectif pour une petite élite Les élèves de ce cursus tirent profit de cette formation en dix mois, 
durant laquelle ils sont rémunérés, pour accélérer leur carrière.",0
